{
  "run_id": "S7_GOLD_RUSH_20251231_193159",
  "source": "14_CONSCIOUSNESS",
  "timestamp": "2025-12-31T19:31:59.083579",
  "fleet": "BUDGET_FLEET",
  "question_sets": [
    "baseline",
    "consciousness_markers",
    "custom_template",
    "diamond_analysis",
    "identity_deep_dive",
    "meta_awareness",
    "drift_calibration"
  ],
  "total_calls": 294,
  "successful_calls": 210
}